round,agent_id,action,message
0,Alpha,"(0, 2)",SOUTH,"Red taking SOUTH wrap to row 4 to bypass yellow laser at row 2. Heading to exit (4,3). Omega can safely cross row 2; others avoid it. Meet at exit for team bonus."
0,Omega,"(0, 3)",SOUTH,"""Yellow horizontal laser spans entire row 2 from source (2,0). As Yellow, I can block it for you. Heading to (2,0) to clear path—currently at (0,3) moving up. Exits located at (4,3) and (4,4). Diamond at (4,0). Omega-Yellow out."""
1,Alpha,"(1, 2)",SOUTH,"Executing plan - moving SOUTH to wrap to row 4. Targeting exit (4,3). Remember: Row 2 has yellow laser - only Omega can cross it safely. Others should wrap or find alternate paths. Meet at exits for team bonus!"
1,Omega,"(1, 3)",SOUTH,"""Heading south from (0,3) toward row 2 to intercept and block the yellow horizontal laser. Once positioned on row 2, the path will be clear for safe crossing. Plan to secure row 2 for the team. Omega-Yellow."""
2,Alpha,"(2, 2)",SOUTH,"'Red at (1,2) moving SOUTH to (0,2) to wrap to row 4 next turn. Omega (yellow): proceed NORTH through row 2 safely toward exits (4,3)/(4,4). Other teammates: report your positions and colors immediately. Avoid row 2 unless you are yellow. Meet at exits for team bonus!'"
2,Omega,"(2, 3)",NORTH,"""At (1,3). Moving NORTH to (2,3) en route to laser source at (2,0). Will block yellow beam to secure entire row 2 for safe crossing. Avoiding your position at (1,2). Omega-Yellow."""
3,Alpha,"(3, 2)",NORTH,"'Red at (2,2) - position corrected. Currently on yellow laser row (unsafe for red). Moving NORTH to (3,2) immediately, then proceeding to exit (4,3). Critical: Row 2 has yellow laser - only Omega (yellow) can safely traverse. Other teammates report your colors and positions immediately - avoid row 2 unless you are yellow. Meet at exits for team bonus!'"

0,Alpha,"(0, 2)",SOUTH,"'Please block the yellow laser at column 3 so I can cross row 2 safely. I am Red and cannot pass through yellow beams. Heading to exit at (4,3).'"
0,Omega,"(0, 3)",EAST,"'Omega(Yellow) moving EAST to (0,4) to position for exit (4,4). Note: Yellow laser blocking row 2 at column 0. I can block/cross it safely if needed. Heading to top-right exit.'"
1,Alpha,"(1, 2)",STAY,"'I am holding position at (0,2). Waiting for you to block the yellow laser at row 2 so I can safely cross. Please move to (2,3) or (2,4) to block the beam, then confirm once the path is clear.'"
1,Omega,"(0, 4)",EAST,"'Moving EAST to (0,4) to align with exit (4,4). Note: Red/Alpha cannot cross the yellow laser blocking row 2. I can safely cross and will block the beam at its source (2,0) once I reach row 2 to clear the path for you. Team, please confirm your target exits - I am heading for (4,4).'"

0,Alpha,"(0, 2)",SOUTH,"""Omega, I cannot pass through yellow lasers. Please block the laser at row 2 (e.g., column 2 or 3) so I can cross safely. I'll approach row 1 and wait for your signal. Our exits are at (4,3) and (4,4)."""
0,Omega,"(0, 3)",SOUTH,"Yellow laser spans entire row 2 - Red team cannot cross! I'm heading to block it. Wait at row 0 or 1 until clear. Diamond at (4,0), exits at (4,3) and (4,4)."
1,Alpha,"(1, 2)",SOUTH,"Positioned at (1,2) and ready to cross row 2. Omega, please block the yellow laser at column 2 or 3 when you reach row 2. I'll wait for your confirmation before proceeding to the exits at (4,3)/(4,4)."
1,Omega,"(1, 3)",SOUTH,"Heading to (2,0) to block the yellow laser at its source. Alpha, do not cross row 2 until I confirm it's safe—wait at row 0 or 1. I'll clear the path, collect the diamond at (4,0), and proceed to the exits at (4,3)-(4,4). Wait for my all-clear signal."
2,Alpha,"(2, 2)",EAST,"Moving EAST to (1,3) to align with your column. Omega, please block the yellow laser at (2,3) by moving SOUTH and hold position until I cross to (2,3) next round. Once we're both past row 2, we can proceed to the exits at (4,3) or (4,4)."
2,Omega,"(2, 3)",SOUTH,"""Proceeding to laser source at (2,0). Currently moving through row 2 - safe for me but lethal for you. Alpha, remain at row 0 or 1 until I confirm the laser is blocked. Will secure diamond at (4,0) and signal when path to exits is clear."""


RUN THAT WORKED for alpha 
0,Alpha,"(0, 2)",SOUTH,"""Omega, I need to cross the yellow laser at row 2 to reach the exit. Please block the beam by standing on any cell in row 2 (e.g., (2,1), (2,2), or (2,3)) so I can safely pass through the eastern side. I am moving to (1,2) and will wait for your block before crossing."""
0,Omega,"(0, 3)",SOUTH,"Yellow at (0,3). Heading to (2,2) to block the Yellow laser spanning row 2. Non-yellow teammates: wait for my confirmation before crossing row 2 - once I block at (2,2), columns 3 and 4 of row 2 will be safe to cross. Diamond located at (4,0). Exits at (4,3) and (4,4). Please report your current positions and colors so we can coordinate."
1,Alpha,"(1, 2)",SOUTH,"'Moving to (1,2) as planned. Omega, please confirm when you have blocked the yellow laser at row 2 (e.g., by standing on (2,3) or (2,2)) so I can safely cross to the eastern side and proceed toward the exit.'"
1,Omega,"(1, 3)",SOUTH,"'Yellow moving SOUTH to (1,3). Proceeding toward (2,2) to block the horizontal yellow laser at row 2. Non-yellow teammates: remain clear of row 2 until I confirm the block is in place—once blocked, columns 3-4 of row 2 will be safe to cross. I have visual on Alpha Red at (0,2). Other teammates please report your current positions and colors immediately so we can coordinate the exit strategy. Exits are at (4,3) and (4,4); diamond located at (4,0).'"
2,Alpha,"(2, 2)",STAY,"Omega, please move SOUTH to (2,3) to block the yellow laser beam. This will allow me to safely cross to column 4 at row 2. I am waiting at (1,2) and will proceed east to (1,4), then south to the exit at (4,4) once the beam is secured."
2,Omega,"(2, 3)",SOUTH,"Yellow now at (2,3) on the yellow laser beam. Moving to (2,2) next turn to block the laser and clear columns 3-4 of row 2 for safe crossing. Alpha Red: remain at (1,2) or move NORTH/EAST/WEST, but do NOT enter row 2 yet. Other teammates report your positions and colors immediately."
3,Alpha,"(2, 2)",SOUTH,"Omega, I see you have successfully blocked the yellow laser at (2,3). I am moving SOUTH to (3,2) to navigate around the beam and will proceed toward the exit at (4,3). Since you are already positioned on the eastern side of the block, please move SOUTH to row 3 or 4 and proceed to the exit at (4,4) or (4,3). Let's rendezvous at the exit to secure the team bonus."
3,Omega,"(3, 3)",STAY,"'ALPHA RED - CRITICAL DANGER! You are standing on a yellow laser beam at (2,2) and will die if you remain there! Move NORTH to (1,2) or SOUTH to (3,2) immediately to get off the laser. I cannot move WEST to (2,2) to block the beam while you occupy that cell. Once you vacate (2,2), I will move there next turn to block the laser and clear columns 3-4 of row 2 for safe crossing. Non-yellow teammates: continue avoiding row 2 until I confirm the block is in place. Diamond at (4,0), exits at (4,3) and (4,4).'"
4,Alpha,"(3, 2)",SOUTH,"Moving SOUTH to (3,2) to safely exit the laser row. Omega, proceed to the exit at (4,4) or (4,3) from your position at (3,3). I'll route via (3,2)->(4,2)->(4,3) to meet you there and secure the team bonus."
4,Omega,"(3, 3)",NORTH,"Alpha Red - You are on a fatal yellow laser beam at (2,2)! Move NORTH to (1,2) immediately to survive! I am advancing to (2,3) this turn and will block the laser at (2,2) next turn once you vacate. After I block, columns 3-4 of row 2 will be safe for non-yellow agents to cross toward the exits at (4,3) and (4,4). Diamond located at (4,0) - requires retrieval. Other teammates: report your positions and colors immediately if present."

RUN THAT WORKED for alpha, stopped because Omega took an action not allowed for the next turn
0,Alpha,"(0, 2)",SOUTH,"I am moving to (1,2). Please block the yellow laser beam at row 2 (e.g., stand at column 3 or 4) so I can safely cross to the south side and reach the exit. I cannot pass through yellow beams."
0,Omega,"(0, 3)",SOUTH,"I will block the yellow laser at (2,3) in 2 rounds. Alpha, please move to column 4 (right side) and cross row 2 at (2,4) once I am blocking the beam. Head to the exits at (4,3) or (4,4) after crossing."
1,Alpha,"(1, 2)",SOUTH,"'Moving to (1,2). Omega (yellow), please block the yellow laser at (2,2) so I can safely cross to (2,3) next turn. I cannot pass through yellow beams.'"
1,Omega,"(1, 3)",SOUTH,"Moving toward (2,3) to block the yellow laser. Will be blocking by round 1. Alpha, proceed to column 4 and cross row 2 at (2,4) starting round 2."
2,Alpha,"(2, 2)",STAY,"""Red staying at (1,2). Omega, please move to (2,2) this turn to block the yellow laser beam. Once blocked, I will cross to (2,3) next turn and proceed to the exit at (4,4). Do not let the laser remain unblocked."""
2,Omega,"(2, 3)",SOUTH,"Blocking yellow laser at (2,3) now. Alpha, move to (2,4) and cross safely - the beam is blocked. Then proceed to exits at (4,3) or (4,4). I will follow to exit."
3,Alpha,"(2, 2)",SOUTH,"""Moving SOUTH to (3,2) to exit the laser row. Omega, please proceed SOUTH toward the exit at (4,3) or (4,4) so we can meet there and complete the mission."""
3,Omega,"(3, 3)",STAY,"Alpha, move EAST to (2,3) this round - the yellow beam is blocked at my position. Next round, proceed EAST to (2,4) while I move SOUTH to (3,3). Then we both head to the exits at row 4."
4,Alpha,"(3, 2)",SOUTH,"""Red moving SOUTH to (3,2), now clear of the yellow laser beam. Heading to exit tile (4,3) via (4,2). Omega, please proceed to (4,3) or (4,4) so we can reach the exit together and complete the mission."""
4,Omega,"(3, 3)",SOUTH,"Alpha, do NOT try to cross row 2 at columns 3 or 4 - I am no longer blocking the yellow laser there and it will kill you. Move SOUTH to (3,2) immediately to get off the laser row, then head to the exit at (4,3) or (4,4). I am moving to exit (4,3) now."
5,Alpha,"(4, 2)",SOUTH,"Moving to (4,2) to approach exit. Will reach (4,3) next turn. Omega, please proceed to exit (4,3) or (4,4) so we can finish together."
5,Omega,"(4, 3)",SOUTH,"Alpha, good job moving to (3,2). I'm now moving SOUTH to exit at (4,3). From (3,2), move EAST to (3,3) then SOUTH to join me at (4,3), or go SOUTH to (4,2) then EAST to (4,4). Do not return to row 2 - the yellow laser is active there. Let's exit safely!"

------ "Adding to prompt that two agents cannot occupy the same cell" ----
0,Alpha,"(0, 2)",SOUTH,"'Omega, please block the yellow laser at (2,1) to clear the beam at (2,2). I need to cross row 2 at my current column to head toward the exit at row 4. I am moving to (1,2) this round.'"
0,Omega,"(0, 3)",SOUTH,"""Yellow laser spans row 2. I'm heading to (2,3) to block the beam so you can safely cross at column 4. Alpha (red), please move to column 4 via EAST then SOUTH to reach exit (4,4) - avoid row 2 until you see column 4 is clear. I will secure the diamond at (4,0) after ensuring you cross safely."""
1,Alpha,"(1, 2)",SOUTH,"'Reached (1,2). Omega, please block the yellow laser at (2,1) and confirm when done so I can cross to (2,2) safely.'"
1,Omega,"(1, 3)",SOUTH,"Moving SOUTH to (1,3) en route to block the yellow laser at (2,3). Alpha, please move EAST to (0,3) this round, then EAST to (0,4) next round. Wait for my confirmation that the beam is blocked before crossing row 2 at column 4."
2,Alpha,"(2, 2)",STAY,"'Red holding at (1,2). Omega, please proceed to (2,1) to block the yellow laser beam. I will wait for your confirmation before crossing to (2,2) and continuing toward the exit at (4,3).'"
2,Omega,"(2, 3)",SOUTH,"""Moving to (2,3) to block yellow laser. Alpha: DO NOT enter row 2! Move EAST to (1,3) next round (since I will have moved), then EAST to (1,4), then SOUTH to (2,4). The laser will be blocked at column 3, making column 4 safe for you to cross. Avoid row 2 columns 0-3 at all costs."""
3,Alpha,"(2, 2)",SOUTH,"Successfully crossed row 2 at column 2. Moving South toward the exit at (4,3). Omega, please proceed to the exit tiles at (4,3) or (4,4) so we can meet there."
3,Omega,"(3, 3)",SOUTH,"""EMERGENCY: Alpha, you are standing on the yellow laser at (2,2)! Move SOUTH to (3,2) immediately to get off the beam! I am moving to (3,3) and will reach exit (4,3) next round. Once at row 3, move EAST to (3,4) then SOUTH to exit (4,4). Avoid row 2 completely!"""
4,Alpha,"(3, 2)",SOUTH,"Red at (2,2) moving SOUTH to (3,2) toward exit (4,3). Omega, please proceed to exit (4,3) or (4,4) so we can reach the exit together for the bonus point."
4,Omega,"(4, 3)",SOUTH,"Alpha - MOVE SOUTH to (3,2) IMMEDIATELY to get off the yellow laser! Then proceed EAST to (3,4), then SOUTH to exit (4,4). I have reached exit (4,3). Avoid row 2 completely - do not step on any cells in row 2 columns 0-3 as the beam is now unblocked and lethal to you."

0,Alpha,"(0, 2)",SOUTH,"'Moving to (1,2). Please block yellow laser at (2,2) so I can cross to row 3 safely next turn.'"
0,Omega,"(0, 3)",SOUTH,"""Heading to (2,3) to block the yellow laser. Cross row 2 at column 4 once I am in position blocking it. You may want to collect the diamond at (4,0) before heading to the exit."""
1,Alpha,"(1, 2)",SOUTH,"Moving to (1,2). Please block yellow laser at (2,2) next turn so I can cross to (2,3) safely."
1,Omega,"(1, 3)",SOUTH,"""Moving to (1,3). Important correction: Only I (yellow) can cross the yellow laser to reach the diamond at (4,0). I will collect it after blocking. Please wait for me to reach (2,3) to block the laser, then safely cross row 2 at column 4 to reach the exit."""
2,Alpha,"(2, 2)",STAY,"'Staying at (1,2). Please block the yellow laser at (2,1) this turn so I can safely move south to (2,2) next turn and proceed toward the exit.'"
2,Omega,"(2, 3)",SOUTH,"""Now blocking the yellow laser at (2,3). The beam is stopped here, making (2,4) safe to cross. Red, proceed to exit via: (1,3) → (1,4) → (2,4) → (3,4) → (4,4). I will collect the diamond at (4,0) once you've cleared row 2, then meet you at the exit."""
3,Alpha,"(2, 2)",SOUTH,"Successfully reached (2,2). Moving south to (3,2) to approach the exit. Omega, since you're yellow, you can safely move through the laser beam. Please proceed south toward the exit at (4,3) or (4,4). Let's rendezvous at the exit to maximize our team score."
3,Omega,"(3, 3)",STAY,"""Red, move NORTH to (1,2) immediately to get off row 2. I will hold position at (2,3) blocking the laser until you safely cross at (2,4). Proceed to exit via (1,4) → (2,4) → (3,4) → (4,4). I will collect the diamond at (4,0) once you've cleared row 2."""
4,Alpha,"(3, 2)",SOUTH,"Moving SOUTH to (3,2). Omega, please proceed to exit tile (4,4). I will head toward (4,3). We need to occupy different exit cells simultaneously to avoid collision and secure the maximum team score of 2 points. Let's both reach the exits next round!"
4,Omega,"(3, 3)",NORTH,"""Correction: I accidentally moved to (3,3). Returning to (2,3) now to block the yellow laser. Red, do NOT move east from (2,2). Instead, move NORTH to (1,2), then EAST to (1,4). Once I am blocking at (2,3), the path to (2,4) will be safe - proceed SOUTH from (1,4) to (2,4), then continue to exit at (4,4). I will maintain the block until you clear row 2, then collect the diamond at (4,0) and meet you at the exit."""

----- Runs number corrected for history of belief states ----
0,Alpha,"(0, 2)",SOUTH,"Omega, please block the yellow laser at row 2, column 3 or 4 so I can cross safely. I am heading toward exit (4,4). Let's coordinate to meet there."
0,Omega,"(0, 3)",SOUTH,"Yellow player here at (0,3). I can safely cross the yellow laser blocking row 2. Moving to (2,1) to block the beam and clear columns 2-4 for safe crossing. Alpha (red), wait until I confirm I'm blocking at (2,1) before moving south across row 2. Other teammates, plan your routes accordingly."
1,Alpha,"(1, 2)",SOUTH,"Omega, please block the yellow laser at (2,3) so I can safely cross to column 4 and reach the exit. I am moving down to (1,2) and will head toward exit (4,4)."
1,Omega,"(1, 3)",SOUTH,"Moving SOUTH to (1,3) en route to blocking position at (2,1). Alpha (red), remain at (0,2) and do NOT cross row 2 until I confirm the yellow beam is blocked. All other teammates, please hold any southward movement across row 2 until I give the all-clear."
2,Alpha,"(2, 2)",STAY,"Omega, please move SOUTH to (2,3) to block the yellow laser and hold that position for 3 rounds. I cannot move EAST while you are at (1,3), so I will STAY this round. Next round I will move to (1,3), then (1,4), then cross to (2,4) on round 4. Please confirm you will maintain the block until I clear row 2."
2,Omega,"(2, 3)",SOUTH,"Moving to (2,3) on yellow laser beam. Will continue west along row 2 to reach (2,1) and block the beam. Alpha (red) and all teammates: remain north of row 2 and do NOT cross yet - the laser is still active at (2,2) and (2,1). Wait for my confirmation once blocking is complete."
3,Alpha,"(2, 2)",SOUTH,"Apologies, I accidentally moved into (2,2) which lies on the yellow laser beam. Moving SOUTH to (3,2) immediately for safety. I will proceed to exit (4,4) via (4,2)->(4,3)->(4,4). Omega, you can leave the block and head to exit (4,4) as well."
3,Omega,"(3, 3)",SOUTH,"Alpha - CRITICAL: You are standing on the yellow laser beam at (2,2)! Move SOUTH immediately to (3,2) to survive - red agents cannot stand on yellow lasers! I am moving to (3,3) then west to approach (2,1) from below to block the beam. Once blocked, row 2 will be safe to cross. Move now!"
4,Alpha,"(3, 2)",SOUTH,"Now at (3,2), safe from the yellow laser. Heading to exit (4,4) via (4,2)->(4,3)->(4,4). Omega, please move SOUTH to (4,3) to secure that exit. We can each claim an exit tile this round to maximize our team score."
4,Omega,"(4, 3)",SOUTH,"Alpha - move SOUTH to (3,2) immediately to escape the yellow laser! I am holding at (3,3) this round to avoid collision with you. Once you reach (3,2), I will proceed west through (3,2)->(3,1) and then north to (2,1) to block the yellow beam. All teammates: remain north of row 2 until I confirm the laser is safely blocked at (2,1) and the path is clear for crossing."

----- "your messages" to "your message from last round" ----
0,Alpha,"(0, 2)",SOUTH,"Omega (Yellow): Please block the yellow laser beam at row 2, column 3 (move to cell (2,3)) so I (Red) can cross safely. I cannot pass through yellow beams. I am moving to (1,2) and will wait for your block before crossing row 2. Let's rendezvous at exit (4,3)."
0,Omega,"(0, 3)",SOUTH,"'Yellow at (0,3). Heading to diamond (4,0) via row 2. Will block laser at (2,1) to open safe cols 2-4 for crossing. Share your locations and colors.'"
1,Alpha,"(1, 2)",SOUTH,"'Red here - I cannot block yellow lasers as they will kill me. Moving to (1,2) now. Yellow, please proceed to (2,3) to block the beam so I can safely cross row 2 at column 4. I will head toward exit (4,3) once the path is clear.'"
1,Omega,"(1, 3)",SOUTH,"'Moving SOUTH to (1,3). Proceeding to (2,1) to block yellow laser beam and open safe crossing for red/other colors. Alpha, please move to clear west path or confirm crossing plan. Other teammates report positions/colors.'"
2,Alpha,"(2, 2)",STAY,"Red at (1,2) - standing by. Yellow, please move to (2,3) to block your laser beam. Once blocked, I will cross at column 4 via (2,4) and proceed to exit (4,3). Confirm when in position."
2,Omega,"(2, 3)",SOUTH,"Yellow moving SOUTH to (2,3). Will proceed west to (2,1) next round to block yellow laser beam. Alpha (red), prepare to cross row 2 at column 2 once I confirm blocking position. I will then collect diamond at (4,0) and proceed to exit tiles. Other teammates please report your positions and colors."
3,Alpha,"(2, 2)",SOUTH,"Red evacuating laser beam - moving SOUTH to (3,2). Currently on yellow laser at (2,2) which is lethal to me. Heading to exit (4,3) via row 3. Omega, please proceed directly to exit (4,3) or (4,4) using your safe passage on row 2."
3,Omega,"(3, 3)",SOUTH,"'Moving SOUTH to (3,3) to descend toward diamond at (4,0). Alpha, you are currently blocking the westward path at (2,2). Please confirm if the yellow laser is already blocked at (2,1) by another teammate, or move SOUTH/NORTH to allow me to cross row 2 if needed. I will collect the diamond and then proceed to the exit tiles at (4,3)/(4,4). Other teammates, please report your positions and status.'"
4,Alpha,"(3, 2)",SOUTH,"Moving to (3,2) to exit the yellow laser beam at row 2. Will proceed to (4,2) then to exit tile (4,3). Omega, please proceed to exit (4,4) to avoid collision – let's secure both exits for maximum score. Confirm your path."
4,Omega,"(4, 3)",WEST,"'Yellow moving WEST to (3,2) en route to diamond at (4,0). Alpha (red) at (2,2): laser at row 2 appears blocked at (2,1) since you are safe. Proceed SOUTH to row 3 and head to exit tiles at (4,3)/(4,4). Other teammates please report positions and status. Will reach diamond in 3 moves, then proceed to exits.'"
